{
  "product_id": "GC-0001",
  "name_en": "Ceremonial matcha starter set (whisk, scoop, bowl)",
  "name_ar": "طقم ماتشا للمبتدئين (مضرب، ملعقة، وعاء)",
  "category": "drinkware",
  "tags": ["matcha", "starter set", "chasen", "gift box"],
  "interest_keys": ["matcha", "cafe_culture"],
  "style_tags": ["minimal", "cozy"],
  "price_sar": 189,
  "currency": "SAR",
  "budget_band": "100_250",
  "age_min": 16,
  "age_max": 65,
  "occasions": ["birthday", "graduation", "thank_you", "just_because"],
  "relationship_fit": ["friend", "best_friend", "sister", "brother", "colleague", "classmate", "relative", "partner"],
  "giftability": 0.92,
  "embarrassment_risk": 0.05,
  "novelty": 0.60,
  "is_experience": false,
  "personalizable": false,
  "requires_size": false,
  "available_in_jeddah": true,
  "delivery_days": 3,
  "retailer_hint": "Noon / local specialty roastery",
  "product_url": null,
  "image_url": null,
  "data_status": "demo",
  "verified_at": null,
  "notes": "Demo row. Price band is realistic for Jeddah but is not a quoted price; must be re-sourced and set to data_status=verified before any real user sees it."
}
